{
  "artifact": "heartbeat-two-participant-demonstration",
  "baseline": {
    "after": {
      "containers": 9,
      "images": 36,
      "networks": 4,
      "volumes": 20
    },
    "before": {
      "containers": 9,
      "images": 36,
      "networks": 4,
      "volumes": 20
    },
    "delta": {
      "containers": {
        "after": 9,
        "before": 9,
        "leaked": [],
        "removed": []
      },
      "images": {
        "after": 34,
        "before": 34,
        "leaked": [
          "6ac08c13a39b",
          "7a7514baab4d"
        ],
        "removed": [
          "45100154648f",
          "715fd7602185"
        ]
      },
      "networks": {
        "after": 4,
        "before": 4,
        "leaked": [],
        "removed": []
      },
      "volumes": {
        "after": 20,
        "before": 20,
        "leaked": [],
        "removed": []
      }
    },
    "torn_down": true
  },
  "checks": [
    {
      "check": "every_hardening_rule_held_on_the_running_containers",
      "detail": [],
      "passed": true
    },
    {
      "check": "every_scenario_passed",
      "detail": {
        "failed": 0,
        "failed_scenarios": [],
        "ok": true,
        "passed": 5,
        "total": 5
      },
      "passed": true
    },
    {
      "check": "the_host_returned_to_its_pre_run_baseline",
      "detail": "no containers, volumes or networks leaked",
      "passed": true
    }
  ],
  "hardening": [
    {
      "check": "the_container_is_actually_running",
      "container": "hb-demo-publisher",
      "detail": "running",
      "passed": true
    },
    {
      "check": "it_runs_as_a_non_root_user",
      "container": "hb-demo-publisher",
      "detail": "10001:10001",
      "passed": true
    },
    {
      "check": "it_is_not_privileged",
      "container": "hb-demo-publisher",
      "detail": false,
      "passed": true
    },
    {
      "check": "its_root_filesystem_is_read_only",
      "container": "hb-demo-publisher",
      "detail": true,
      "passed": true
    },
    {
      "check": "every_capability_is_dropped",
      "container": "hb-demo-publisher",
      "detail": [
        "ALL"
      ],
      "passed": true
    },
    {
      "check": "and_none_is_added_back",
      "container": "hb-demo-publisher",
      "detail": [],
      "passed": true
    },
    {
      "check": "privilege_escalation_is_refused",
      "container": "hb-demo-publisher",
      "detail": [
        "no-new-privileges:true"
      ],
      "passed": true
    },
    {
      "check": "its_pid_count_is_bounded",
      "container": "hb-demo-publisher",
      "detail": 128,
      "passed": true
    },
    {
      "check": "its_memory_is_bounded",
      "container": "hb-demo-publisher",
      "detail": 268435456,
      "passed": true
    },
    {
      "check": "its_cpu_is_bounded",
      "container": "hb-demo-publisher",
      "detail": 500000000,
      "passed": true
    },
    {
      "check": "it_does_not_use_host_networking",
      "container": "hb-demo-publisher",
      "detail": "mcp-heartbeat-demo_demo",
      "passed": true
    },
    {
      "check": "it_is_attached_only_to_the_private_demo_network",
      "container": "hb-demo-publisher",
      "detail": [
        "mcp-heartbeat-demo_demo"
      ],
      "passed": true
    },
    {
      "check": "it_bind_mounts_nothing_from_the_host",
      "container": "hb-demo-publisher",
      "detail": [],
      "passed": true
    },
    {
      "check": "it_mounts_no_docker_socket_and_no_host_home",
      "container": "hb-demo-publisher",
      "detail": [],
      "passed": true
    },
    {
      "check": "it_maps_no_host_device",
      "container": "hb-demo-publisher",
      "detail": null,
      "passed": true
    },
    {
      "check": "it_publishes_at_least_one_port",
      "container": "hb-demo-publisher",
      "detail": {
        "8981/tcp": [
          {
            "HostIp": "127.0.0.1",
            "HostPort": "8981"
          }
        ]
      },
      "passed": true
    },
    {
      "check": "every_published_port_is_bound_to_loopback_only",
      "container": "hb-demo-publisher",
      "detail": [
        "127.0.0.1"
      ],
      "passed": true
    },
    {
      "check": "its_only_writable_scratch_is_a_bounded_tmpfs",
      "container": "hb-demo-publisher",
      "detail": {
        "/tmp": "size=16m,mode=1777"
      },
      "passed": true
    },
    {
      "check": "the_container_is_actually_running",
      "container": "hb-demo-observer",
      "detail": "running",
      "passed": true
    },
    {
      "check": "it_runs_as_a_non_root_user",
      "container": "hb-demo-observer",
      "detail": "10001:10001",
      "passed": true
    },
    {
      "check": "it_is_not_privileged",
      "container": "hb-demo-observer",
      "detail": false,
      "passed": true
    },
    {
      "check": "its_root_filesystem_is_read_only",
      "container": "hb-demo-observer",
      "detail": true,
      "passed": true
    },
    {
      "check": "every_capability_is_dropped",
      "container": "hb-demo-observer",
      "detail": [
        "ALL"
      ],
      "passed": true
    },
    {
      "check": "and_none_is_added_back",
      "container": "hb-demo-observer",
      "detail": [],
      "passed": true
    },
    {
      "check": "privilege_escalation_is_refused",
      "container": "hb-demo-observer",
      "detail": [
        "no-new-privileges:true"
      ],
      "passed": true
    },
    {
      "check": "its_pid_count_is_bounded",
      "container": "hb-demo-observer",
      "detail": 128,
      "passed": true
    },
    {
      "check": "its_memory_is_bounded",
      "container": "hb-demo-observer",
      "detail": 268435456,
      "passed": true
    },
    {
      "check": "its_cpu_is_bounded",
      "container": "hb-demo-observer",
      "detail": 500000000,
      "passed": true
    },
    {
      "check": "it_does_not_use_host_networking",
      "container": "hb-demo-observer",
      "detail": "mcp-heartbeat-demo_demo",
      "passed": true
    },
    {
      "check": "it_is_attached_only_to_the_private_demo_network",
      "container": "hb-demo-observer",
      "detail": [
        "mcp-heartbeat-demo_demo"
      ],
      "passed": true
    },
    {
      "check": "it_bind_mounts_nothing_from_the_host",
      "container": "hb-demo-observer",
      "detail": [],
      "passed": true
    },
    {
      "check": "it_mounts_no_docker_socket_and_no_host_home",
      "container": "hb-demo-observer",
      "detail": [],
      "passed": true
    },
    {
      "check": "it_maps_no_host_device",
      "container": "hb-demo-observer",
      "detail": null,
      "passed": true
    },
    {
      "check": "every_published_port_is_bound_to_loopback_only",
      "container": "hb-demo-observer",
      "detail": [],
      "passed": true
    },
    {
      "check": "its_only_writable_scratch_is_a_bounded_tmpfs",
      "container": "hb-demo-observer",
      "detail": {
        "/tmp": "size=16m,mode=1777"
      },
      "passed": true
    }
  ],
  "notes": {
    "hardening_source": "Every hardening check reads `docker inspect` on the RUNNING container, not the Compose file.",
    "images": "`docker compose down` never removes images, by design \u2014 a re-run is fast because they survive. The image delta is therefore recorded, not asserted to zero. `down --rmi local` removes them."
  },
  "observation": {
    "environment": {
      "layout": "standalone",
      "max_skew_seconds": 3600.0,
      "publisher_state": {
        "epoch_id": "295255aa66996687",
        "frozen": false,
        "lease_seconds": 6.0,
        "next_sequence": 1,
        "participant_id": "demo/publisher-1",
        "restarts": 1,
        "status": "draining"
      }
    },
    "ledgers": {
      "refusals": [],
      "transitions": [
        {
          "at": "2026-08-17T03:43:54.368Z",
          "epoch_id": "62e05ca77c3d6d68",
          "expires_at": "2026-08-17T03:44:00.368Z",
          "sequence": 0
        },
        {
          "at": "2026-08-17T03:43:54.771Z",
          "epoch_id": "62e05ca77c3d6d68",
          "expires_at": "2026-08-17T03:44:00.771Z",
          "sequence": 1
        },
        {
          "at": "2026-08-17T03:43:55.173Z",
          "epoch_id": "62e05ca77c3d6d68",
          "expires_at": "2026-08-17T03:44:01.172Z",
          "sequence": 2
        },
        {
          "at": "2026-08-17T03:43:55.575Z",
          "epoch_id": "62e05ca77c3d6d68",
          "expires_at": "2026-08-17T03:44:01.574Z",
          "sequence": 3
        },
        {
          "at": "2026-08-17T03:43:55.576Z",
          "epoch_id": "62e05ca77c3d6d68",
          "expires_at": "2026-08-17T03:44:01.576Z",
          "sequence": 4
        },
        {
          "at": "2026-08-17T03:43:55.578Z",
          "epoch_id": "62e05ca77c3d6d68",
          "expires_at": "2026-08-17T03:44:01.578Z",
          "sequence": 5
        },
        {
          "at": "2026-08-17T03:44:01.587Z",
          "epoch_id": "295255aa66996687",
          "expires_at": "2026-08-17T03:44:07.587Z",
          "sequence": 0
        }
      ]
    },
    "run": {
      "base_url": "http://hb-demo-publisher:8981",
      "duration_seconds": 7.229,
      "finished_at": "2026-08-17T03:44:01.587Z",
      "participant_id": "demo/publisher-1",
      "started_at": "2026-08-17T03:43:54.358Z"
    },
    "scenarios": [
      {
        "checks": [
          {
            "detail": null,
            "name": "the_first_heartbeat_is_admitted",
            "passed": true
          },
          {
            "detail": 0,
            "name": "it_opens_the_stream_at_sequence_zero",
            "passed": true
          },
          {
            "detail": 5.999289,
            "name": "the_observer_now_holds_a_fresh_lease",
            "passed": true
          },
          {
            "detail": {
              "does_not_mean": "the participant's lease is fresh \u2014 refetch /heartbeat",